{
  "id": "growth-mindset",
  "version": "1.0.0",
  "title": "Growth Mindset",
  "source": "3-item Growth Mindset Scale (Dweck, Implicit Theories of Intelligence). Items transcribed verbatim; see content-sources/growth-mindset.md.",
  "citation": "Dweck, C. S. (1999, 2006). Self-theories: Their role in motivation, personality, and development / Mindset. (3-item growth-mindset measure; items via SPARQtools.)",
  "license": "Dweck mindset items, widely reproduced and used freely for research and education; not formally public domain. See REVIEW.md Layer-2 licensing note.",
  "intro": "Three quick statements about intelligence. This is the one scale designed to move over time — there are no right answers, just where your thinking sits today.",
  "sections": [
    {
      "type": "info",
      "id": "intro",
      "title": "Before you start",
      "body": "Each statement describes a fixed view of intelligence. How much you agree or disagree is the point — and it is allowed to change. A lean either way has a light side and a shadow."
    },
    {
      "type": "scored-likert",
      "id": "main",
      "anchors": ["Strongly agree", "Agree", "Mostly agree", "Mostly disagree", "Disagree", "Strongly disagree"],
      "band_thresholds": { "bands": ["fixed-lean", "mixed", "growth-lean"], "cuts": [0.3333, 0.6667] },
      "items": [
        { "text": "You have a certain amount of intelligence, and you can't really do much to change it.", "scale": "growth_mindset", "reverse": false, "points": 6 },
        { "text": "Your intelligence is something about you that you can't change very much.", "scale": "growth_mindset", "reverse": false, "points": 6 },
        { "text": "You can learn new things, but you can't really change your basic intelligence.", "scale": "growth_mindset", "reverse": false, "points": 6 }
      ],
      "scales": [
        {
          "id": "growth_mindset",
          "name": "Mindset about intelligence",
          "construct_explainer": "An implicit theory of intelligence is a belief about whether ability is mostly fixed or can grow with effort and strategy. These beliefs relate to how people respond to difficulty, and — unlike a trait — they can shift over time. This is a snapshot of a current belief, not a permanent label. (Higher = more disagreement with the fixed statements = a more growth-leaning view.)",
          "bands": {
            "fixed-lean": {
              "light": "A lean toward 'ability is fairly fixed' can come with valuing natural strengths and being realistic about limits.",
              "shadow": "It can also make setbacks feel like proof of a ceiling, which can quietly discourage effort.",
              "one_thing_to_try": "Recall one skill that genuinely improved with practice, and name exactly what the practice was."
            },
            "mixed": {
              "light": "A mix of views tends to treat both effort and natural difference as real.",
              "shadow": "It can swing toward the fixed view under stress or right after a failure.",
              "one_thing_to_try": "Next time something feels hard, add the word 'yet' — as in 'I can't do this yet'."
            },
            "growth-lean": {
              "light": "A lean toward 'ability can grow' often comes with treating difficulty as part of learning rather than a verdict.",
              "shadow": "A strong lean can underplay real constraints, or turn into pressure to always be improving.",
              "one_thing_to_try": "Pick one area where 'good enough for now' is fine, and notice that not everything has to be a growth project."
            }
          }
        }
      ]
    },
    {
      "type": "free-reflection",
      "id": "synthesis",
      "title": "Your turn",
      "prompt": "Where did your thinking sit today, and does that match how you handle hard things? What is one situation where leaning more toward 'this can grow' would help?",
      "placeholder": "In my own words…",
      "is_snapshot": true
    }
  ]
}
