{
  "id": "self-efficacy",
  "version": "1.0.0",
  "title": "Self-Efficacy",
  "source": "General Self-Efficacy Scale (GSE), 10 items. Items transcribed verbatim from the retrieved source; see content-sources/self-efficacy.md (item wording flagged for primary-source verification).",
  "citation": "Schwarzer, R., & Jerusalem, M. (1995). Generalized Self-Efficacy scale. In J. Weinman, S. Wright, & M. Johnston (Eds.), Measures in health psychology: A user's portfolio. Causal and control beliefs (pp. 35–37). Windsor, UK: NFER-NELSON.",
  "license": "Free for research and educational (non-commercial) use (Schwarzer & Jerusalem). Not public domain. See REVIEW.md Layer-2 licensing note.",
  "intro": "These ten statements are about how you tend to handle demands and setbacks. There is no pass or fail — self-efficacy is a belief that can shift with experience, not a fixed trait. Notice where your answers lean today.",
  "sections": [
    {
      "type": "info",
      "id": "intro",
      "title": "Before you start",
      "body": "Answer for how true each statement feels for you in general, lately. A higher or lower lean is not better or worse — each has a light side and a shadow."
    },
    {
      "type": "scored-likert",
      "id": "main",
      "anchors": ["Not at all true", "Hardly true", "Moderately true", "Exactly true"],
      "band_thresholds": { "bands": ["low", "balanced", "high"], "cuts": [0.3333, 0.6667] },
      "items": [
        { "text": "I can always manage to solve difficult problems if I try hard enough.", "scale": "self_efficacy", "reverse": false, "points": 4 },
        { "text": "If someone opposes me, I can find the means and ways to get what I want.", "scale": "self_efficacy", "reverse": false, "points": 4 },
        { "text": "I am certain that I can accomplish my goals.", "scale": "self_efficacy", "reverse": false, "points": 4 },
        { "text": "I am confident that I could deal efficiently with unexpected events.", "scale": "self_efficacy", "reverse": false, "points": 4 },
        { "text": "Thanks to my resourcefulness, I can handle unforeseen situations.", "scale": "self_efficacy", "reverse": false, "points": 4 },
        { "text": "I can solve most problems if I invest the necessary effort.", "scale": "self_efficacy", "reverse": false, "points": 4 },
        { "text": "I can remain calm when facing difficulties because I can rely on my coping abilities.", "scale": "self_efficacy", "reverse": false, "points": 4 },
        { "text": "When I am confronted with a problem, I can find several solutions.", "scale": "self_efficacy", "reverse": false, "points": 4 },
        { "text": "If I am in trouble, I can think of a good solution.", "scale": "self_efficacy", "reverse": false, "points": 4 },
        { "text": "I can handle whatever comes my way.", "scale": "self_efficacy", "reverse": false, "points": 4 }
      ],
      "scales": [
        {
          "id": "self_efficacy",
          "name": "General self-efficacy",
          "construct_explainer": "Self-efficacy is the belief that one can handle demands and reach goals through one's own effort. It tends to predict persistence and how challenges are approached, and research suggests it can grow with experience — it describes a current belief, not a fixed trait.",
          "bands": {
            "low": {
              "light": "A lower lean can go with caution and a realistic read of what is genuinely hard.",
              "shadow": "It can also show as holding back from challenges that are actually within reach.",
              "one_thing_to_try": "Pick one task that feels just slightly too hard, and take only the first small step."
            },
            "balanced": {
              "light": "A balanced lean tends to mix confidence with a clear sense of limits.",
              "shadow": "It can dip under stress or in unfamiliar situations.",
              "one_thing_to_try": "Recall one past challenge that turned out okay, and note what actually helped."
            },
            "high": {
              "light": "Answers leaning higher often go with taking demands on directly and recovering from setbacks.",
              "shadow": "A strong lean can tip into underestimating real difficulty or skipping preparation.",
              "one_thing_to_try": "Before the next big task, name one thing that could go wrong and plan a response."
            }
          }
        }
      ]
    },
    {
      "type": "free-reflection",
      "id": "synthesis",
      "title": "Your turn",
      "prompt": "Where did your answers lean, and does that fit how you see yourself? What is one situation where more (or less) self-belief would help, and one small thing you could try?",
      "placeholder": "In my own words…",
      "is_snapshot": true
    }
  ]
}
